{
  "type": "object",
  "properties": {
    "id": {
      "type": "string"
    },
    "kind": {
      "type": "string"
    },
    "candidate": {
      "type": "string"
    },
    "preconditions": {
      "type": "array",
      "items": {
        "type": "string"
      }
    },
    "postconditions": {
      "type": "array",
      "items": {
        "type": "string"
      }
    }
  },
  "required": [
    "id",
    "kind",
    "candidate",
    "preconditions",
    "postconditions"
  ],
  "additionalProperties": false,
  "$schema": "https://json-schema.org/draft/2020-12/schema",
  "title": "Release Candidate Promotion Plan V1"
}
